Ticker,Article Title
['CHGG'],"ONGOING INVESTIGATION REMINDER: The Schall Law Firm Announces it is Investigating Claims Against Chegg, Inc. and Encourages Investors with Losses to Contact the Firm"
['ZG'],"Z; ZG Shareholder Alert: Bronstein, Gewirtz & Grossman, LLC Reminds Zillow Group, Inc. Shareholders of Class Action and Lead Plaintiff Deadline: January 17, 2022"
['BHG'],"BHG ALERT – Labaton Sucharow Investigating Claims on Behalf of Investors in Bright Health Group, Inc."
['BHG'],"Bronstein, Gewirtz & Grossman, LLC Notifies Shareholders of Bright Health Group, Inc. (BHG) Investigation"
['Z'],"Z; ZG Shareholder Alert: Bronstein, Gewirtz & Grossman, LLC Reminds Zillow Group, Inc. Shareholders of Class Action and Lead Plaintiff Deadline: January 17, 2022"
['Z'],"INVESTOR ACTION NOTICE: The Schall Law Firm Encourages Investors in Zillow Group, Inc. with Losses of $100,000 to Contact the Firm"
['Z'],"FILING DEADLINE--Kuznicki Law PLLC Announces Class Actions on Behalf of Shareholders of EAR, LSPD, PTON and ZG"
['Z'],"Z ALERT: The Klein Law Firm Announces a Lead Plaintiff Deadline of January 18, 2022 in the Class Action Filed on Behalf of Zillow Group, Inc. Limited Shareholders"
['Z'],"Z LAWSUIT: The Law Offices of Vincent Wong Notify Investors of a Class Action Lawsuit Involving Zillow Group, Inc."
