Ticker,Article Title
['LFST'],"LIFESTANCE ALERT: Bragar Eagel & Squire, P.C. is Investigating LifeStance Health Group, Inc. on Behalf of LifeStance Stockholders and Encourages Investors to Contact the Firm"
['LFST'],"HAGENS BERMAN, NATIONAL TRIAL ATTORNEYS, Encourages LifeStance Health Group (LFST) Investors to Contact Firm’s Attorneys, Firm Investigating Possible Securities Law Violations"
['LFST'],"INVESTOR ALERT: Kirby McInerney LLP Continues Investigation of Shareholder Claims on Behalf of LifeStance Health Group, Inc. (LFST) Investors"
['LFST'],"LFST INVESTIGATION ALERT: Robbins Geller Rudman & Dowd LLP Announces Investigation into LifeStance Health Group, Inc. and Encourages Investors with Substantial Losses or Witnesses with Relevant Information to Contact Firm"
['LFST'],"Glancy Prongay & Murray LLP, a Leading Securities Fraud Law Firm, Continues Its Investigation of LifeStance Health Group, Inc. (LFST) on Behalf of Investors"
['LFST'],"The Law Offices of Frank R. Cruz Continues Its Investigation of LifeStance Health Group, Inc. (LFST) on Behalf of Investors"
['LFST'],"Bronstein, Gewirtz & Grossman, LLC Notifies Shareholders of LifeStance Health Group, Inc. (LFST) Investigation"
['LFST'],LFST INVESTOR ALERT: Thornton Law Firm Announces Investigation
['OSH'],"ONGOING INVESTIGATION REMINDER: The Schall Law Firm Announces it is Investigating Claims Against Oak Street Health, Inc. and Encourages Investors with Losses to Contact the Firm"
['CRON'],"ONGOING INVESTIGATION NOTICE: The Schall Law Firm Encourages Investors in Cronos Group Inc. with Losses of $100,000 to Contact the Firm"
['SAVA'],CASSAVA SCIENCES INC. INVESTIGATION ALERT: Wolf Haldenstein Adler Freeman & Herz LLP is investigating potential securities fraud claims on behalf of the shareholders of Cassava Sciences Inc.
['SAVA'],SAVA Stock Alert: The SEC Investigation That Has Cassava Sciences Cratering Today
['LMND'],"METROMILE ALERT: Bragar Eagel & Squire, P.C. Reminds Investors of its Investigation of the Sale of MILE and Encourages Investors to Contact the Firm"
['LMND'],"METROMILE INVESTOR ALERT BY THE FORMER ATTORNEY GENERAL OF LOUISIANA: Kahn Swick & Foti, LLC Investigates Adequacy of Price and Process in Proposed Sale of Metromile - MILE, MILEW"
['LMND'],"SHAREHOLDER ALERT: WeissLaw LLP Investigates Metromile, Inc."
['LMND'],"METROMILE ALERT: Bragar Eagel & Squire, P.C. Investigates Sale of MILE and Encourages Investors to Contact the Firm"
['LMND'],"SHAREHOLDER ALERT: Rigrodsky Law, P.A. Announces Investigation of Metromile, Inc. Merger"
